{
  "contractVersion": 1,
  "pageId": "runtime-module-list",
  "pageKind": "management-list-detail",
  "module": {
    "title": "configured_module_title",
    "entityLabel": "configured_entity_label",
    "requirementIds": ["REQ-P3-LIST-DETAIL"]
  },
  "header": {
    "layout": "single_row",
    "titleSource": "module",
    "rightActions": [
      {"id": "create", "label": "新建", "purpose": "create_record", "kind": "primary", "compact": true, "requiresSelection": false, "requirementId": "REQ-P3-RECORD-CREATE"}
    ]
  },
  "toolbar": {
    "layout": "single_row_wrap",
    "search": {"visible": true, "mode": "fuzzy", "purpose": "quick_text_search"},
    "advancedFilter": {"visible": true, "surface": "drawer", "purpose": "structured_conditions"},
    "import": {"visible": true, "placement": "toolbar_right", "compact": true, "requirementId": "REQ-P5-IMPORT-EXPORT"},
    "export": {"visible": true, "placement": "toolbar_right", "compact": true, "requirementId": "REQ-P5-IMPORT-EXPORT"},
    "batchActions": {
      "visibility": "when_selection_nonempty",
      "actions": [
        {"id": "batch-edit", "label": "批量编辑", "purpose": "edit_selected_records", "kind": "secondary", "compact": true, "requiresSelection": true, "requirementId": "REQ-P3-RECORD-UPDATE"},
        {"id": "batch-delete", "label": "删除", "purpose": "delete_selected_records", "kind": "danger", "compact": true, "requiresSelection": true, "requirementId": "REQ-P3-RECORD-DELETE"},
        {"id": "batch-export", "label": "导出已选", "purpose": "export_selected_records", "kind": "secondary", "compact": true, "requiresSelection": true, "requirementId": "REQ-P5-IMPORT-EXPORT"}
      ]
    }
  },
  "table": {
    "headerVisible": true,
    "density": "compact",
    "selectionControl": "checkbox",
    "rowClick": "open_right_detail",
    "columns": [
      {"id": "sequence", "label": "序号"},
      {"id": "configured-primary", "label": "主字段"},
      {"id": "configured-columns", "label": "已配置列表字段"},
      {"id": "status", "label": "状态"},
      {"id": "updated-at", "label": "更新时间"}
    ],
    "rowActions": [
      {"id": "edit", "label": "编辑", "purpose": "edit_record", "kind": "secondary", "compact": true, "requiresSelection": false, "requirementId": "REQ-P3-RECORD-UPDATE"},
      {"id": "delete", "label": "删除", "purpose": "delete_record", "kind": "danger", "compact": true, "requiresSelection": false, "requirementId": "REQ-P3-RECORD-DELETE"}
    ]
  },
  "detail": {
    "surface": "right_drawer",
    "layout": "tabs",
    "preserveListContext": true,
    "stackedSections": false,
    "relatedDataPlacement": "tabs",
    "tabs": [
      {"id": "overview", "label": "概览", "purpose": "configured_record_fields"},
      {"id": "relations", "label": "关联数据", "purpose": "enabled_record_relations"},
      {"id": "comments", "label": "评论", "purpose": "enabled_record_collaboration"},
      {"id": "files", "label": "文件", "purpose": "enabled_record_files"},
      {"id": "history", "label": "历史", "purpose": "record_change_history"}
    ]
  },
  "optionalEntries": [
    {"id": "favorite_module", "defaultVisible": false, "placement": "absent", "requirementId": null},
    {"id": "follow_record", "defaultVisible": false, "placement": "absent", "requirementId": null},
    {"id": "operations", "defaultVisible": false, "placement": "absent", "requirementId": null},
    {"id": "reports", "defaultVisible": false, "placement": "absent", "requirementId": null},
    {"id": "saved_views", "defaultVisible": false, "placement": "absent", "requirementId": null}
  ],
  "dashboard": {"enabled": false, "primaryEditor": "not_applicable", "primarySurface": "not_applicable", "jsonMode": "not_applicable"},
  "states": {"loading": true, "empty": true, "error": true, "permissionDenied": true}
}
